"通匯金融代號","總單位名稱","帳號長度","地址","電話"
"223","澎湖第二信用合作社","14位","澎湖縣馬公市仁愛路６１號","06 9273821"
"通匯金融代號","支單位名稱","地址","電話"
"2230016","營業部","澎湖縣馬公市仁愛路６１號","06 9273821"
"2230025","民生分社","澎湖縣馬公市民生路１０號","06 9279666"
"2230034","陽明分社","澎湖縣馬公市大仁街８號","06 9261321"
"2230043","澎南分社","澎湖縣馬公市鎖港里２１之５號","06 9952232"
"2230052","白沙分社","澎湖縣白沙鄉赤崁村３６２號","06 9932431"
"2230061","西嶼分社","澎湖縣西嶼鄉池東村１００之１號","06 9983011"
"2230070","湖西分社","澎湖縣湖西鄉湖西村６２之３號","06 9922991"
"2230089","漁港分社","澎湖縣馬公市文學路２４０號","06 9213161"
"2230098","中興分社","澎湖縣馬公市光復路２２９∣１號","06 9276131"