"通匯金融代號","總單位名稱","帳號長度","地址","電話"
"9545812","西畔分部","彰化縣溪州鄉登山路三段１３０號","04 8802173"
"9545823","大庄分部","彰化縣溪州鄉登山路一段１３８號","04 8802927"
"9545502","溪湖鎮農會","彰化縣溪湖鎮員鹿路三段６９號","04 8853316"
"9540507","獅潭鄉農會","苗栗縣獅潭鄉新店村１２５號","037931306"
"9540518","汶水分部","苗栗縣獅潭鄉竹木村４３號","037991541"
"9546901","瑞穗鄉本會","花蓮縣瑞穗鄉中山路一段１２８號","03 8872226"
"9546912","富源分部","花蓮縣瑞穗鄉富民村２３２號","03 8811030"
"9540024","彰化市農會","彰化縣彰化市大竹里彰南路二段２０８號","04 7371178"
"9548905","彰化區漁會","彰化縣鹿港鎮復興路４８５號","04 7788945"
"9548916","王功分部","彰化縣芳苑鄉和平村芳漢路３７７號","04 8936151"
"9548927","芳苑分部","彰化縣芳苑鄉芳中村中央路１３８號","04 8983215"
"9548938","大城分部","彰化縣大城鄉西港村中央路３９號","04 8941820"
"9548949","草港分部","彰化縣鹿港鎮鹿草路四段３５３號","04 7714361"
"9548950","福興分部","彰化縣福興鄉福興村沿海路５段３２號","04 7789687"
"9548961","伸港分部","彰化縣伸港鄉新興路１００號","04 7982064"
"9545306","福興鄉農會","彰化縣福興鄉橋頭村復興路２８號","04 7789226"
"9541906","銅鑼鄉農會","苗栗縣銅鑼鄉永樂路２２號","037981047"
"9541917","中平分部","苗栗縣銅鑼鄉中平村１６３∣１號","037225261"
"9541928","新隆分部","苗栗縣銅鑼鄉新隆村１０４∣１號","037971070"
"9549108","鳳榮地區農會","花蓮縣鳳林鎮光復路１０５號","03 8761166"
"9549119","林榮分部","花蓮縣鳳林鎮林榮路２１２號","03 8771526"
"9549120","萬榮分部","花蓮縣鳳林鎮長橋里１１９號","03 8751400"
"9544907","潭子鄉農會","台中縣潭子鄉潭秀村潭子街三段８１號","04 25344211"
"9544918","頭家分部","台中縣潭子鄉頭家村頭張路一段１３７號","04 25334992"
"9544929","東寶分部","台中縣潭子鄉東寶村雅潭路二段３８２號","04 25328292"
"9544930","栗林辦事處","台中縣潭子鄉中山路三段２６４號","04 25334633"
"9544941","甘蔗辦事處","台中縣潭子鄉潭興路三段１３０號","04 25322981"
"9543405","線西鄉農會","彰化縣線西鄉寓埔村中央路二段２０號","04 7583571"
"9547805","學甲鎮農會","台南縣學甲鎮中正路２６７號","06 7832105"
"9547816","中洲分部","台南縣學甲鎮光華里１０鄰５５２號","06 7832204"
"9547827","宅港分部","台南縣學甲鎮宅港里１鄰１∣２號","06 7832251"
"9547838","頂洲分部","台南縣學甲鎮頂洲里８鄰１０６∣１號","06 7810024"
"9547849","草圣分部","台南縣學甲鎮美豐里２鄰１０∣４號","06 7833465"
"9547850","大灣分部","台南縣學甲鎮大安里１鄰１１２號","06 7833584"
"9541205","頭份鎮農會","苗栗縣頭份鎮中正路１號","037663006"
"9541216","珊湖分部","苗栗縣頭份鎮中正三路２３９號","037601888"
"9541227","上街分部","苗栗縣頭份鎮中正路１７５號","037663206"
"9541238","尖山分部","苗栗縣頭份鎮中華路１５６號","037624009"
"9541249","中山分部","苗栗縣頭份鎮尖豐路５７６號","037635942"
"9541504","頭屋鄉農會","苗栗縣頭屋鄉頭屋村中正街２５號","037250211"
"9541515","明德分部","苗栗縣頭屋鄉明德村８６號","037250988"
"9540909","龍井鄉農會","台中縣龍井鄉龍西村龍門路４０號","04 26396511"
"9540910","龍泉辦事處","台中縣龍井鄉竹坑村沙田路四段１８５號","04 26353652"
"9540921","龍津辦事處","台中縣龍井鄉龍津村中央路一段２４６號","04 26394651"
"9540932","新庄辦事處","台中縣龍井鄉新東村遊園南路１６１號","04 26313546"
"9540943","國際辦事處","台中縣龍井鄉東海村國際街１１７號","04 26331293"
"9548400","龍崎鄉農會","台南縣龍崎鄉崎頂村２２３號","06 5941114"
"9548411","龍船分部","台南縣龍崎鄉龍船村３０∣１６號","06 5947024"
"9540105","礁溪鄉農會","宜蘭縣礁溪鄉六結村中山路一段１７５之１號","03 9882033"
"9540116","四結辦事處","宜蘭縣礁溪鄉吳沙村中正南路一段９７號","03 9283244"
"9540127","龍潭辦事處","宜蘭縣礁溪鄉龍潭村大坡路５８號","03 9284630"
"9540138","德陽辦事處","宜蘭縣礁溪鄉德陽村溫泉路５０號","03 9870244"
"9548307","關廟鄉農會","台南縣關廟鄉香洋村中正路３４３號","06 5952626"
"9548318","龜洞辦事處","台南縣關廟鄉田中村１４３號","06 5551045"
"9548329","埤頭辦事處","台南縣關廟鄉埤頭村４３∣５號","06 5954832"
"9544608","霧峰鄉農會","台中縣霧峰鄉中正村四德路１０號","04 23303171"
"9544619","北柳分會","台中縣霧峰鄉北柳村四德路３８２號","04 23393404"
"9544620","萬豐分會","台中縣霧峰鄉六股村中正路３４５號","04 23393405"
"9544631","吉峰分會","台中縣霧峰鄉吉峰村民生路２３０∣３號","04 23306082"
"9544642","舊正分會","台中縣霧峰鄉舊正村中正路３４號","04 23397035"
"9544653","吉峰路辦事處","台中縣霧峰鄉吉峰路１００之７號","04 23301806"