"通匯金融代號","總單位名稱","帳號長度","地址","電話"
"006","合作金庫商業銀行","存款類一、放款類一13位","台北市館前路７７號","02 23118811"
"通匯金融代號","支單位名稱","地址","電話"
"0060017","總行","台北市館前路７７號","02 23118811"
"0060028","中山路分行","台北市中山北路二段７１號","02 25213211"
"0060039","西門分行","台北市昆明街７７號","02 23814949"
"0060040","延平分行","台北市南京西路３０１號","02 25554111"
"0060051","大稻埕分行","台北市重慶北路二段６７號","02 25568111"
"0060062","東門分行","台北市信義路二段２０８號","02 23933123"
"0060073","松山分行","台北市八德路四段６２２號","02 27656261"
"0060084","新店分行","台北縣新店市光明街３２號","02 29111111"
"0060095","永和分行","台北縣永和市中正路５７５號","02 29236611"
"0060109","三重分行","台北縣三重市正義南路１７號","02 29738111"
"0060110","板橋分行","台北縣板橋市文化路一段２０號","02 29660971"
"0060121","基隆分行","基隆市仁二路２５５號","02 24284181"
"0060132","宜蘭分行","宜蘭縣宜蘭市中山路三段３０號","03 9323911"
"0060143","蘇澳分行","宜蘭縣蘇澳鎮漁港路５６號","03 9962521"
"0060154","桃園分行","桃園縣桃園市中正路５８號","03 3326121"
"0060165","中壢分行","桃園縣中壢市中山路１８０號","03 4225141"
"0060176","新竹分行","新竹市中正路２３號","03 5244151"
"0060187","苗栗分行","苗栗縣苗栗市中正路６６０號","037320921"
"0060198","頭份分行","苗栗縣頭份鎮仁愛路７０號","037665115"
"0060202","豐原分行","台中縣豐原市中正路１０２號","04 25231122"
"0060213","沙鹿分行","台中縣沙鹿鎮沙田路１０６號","04 26622141"
"0060224","台中分行","台中市自由路二段２號","04 22245121"
"0060235","彰化分行","彰化縣彰化市民生路２７９號","04 7225151"
"0060246","員林分行","彰化縣員林鎮中山路一段８４４號","04 8322181"
"0060257","南投分行","南投縣南投市中山街９６號","0492234141"
"0060268","斗六分行","雲林縣斗六市大同路３號","05 5323981"
"0060279","北港分行","雲林縣北港鎮義民路５３號","05 7836136"
"0060280","嘉義分行","嘉義市國華街２７９號","05 2224571"
"0060291","新營分行","台南縣新營市中山路１１５號","06 6324121"
"0060305","台南分行","台南市成功路４８號","06 2232101"
"0060316","成功分行","台南市北門路一段９７號","06 2269161"
"0060327","鳳山分行","高雄縣鳳山市中正路９５號","07 7460181"
"0060338","岡山分行","高雄縣岡山鎮校前路２號","07 6216161"
"0060349","高雄分行","高雄市大勇路９９號","07 5514221"
"0060350","新興分行","高雄市西賢二路１１０號","07 2887121"
"0060361","屏東分行","屏東縣屏東市中正路４２號","08 7343611"
"0060372","潮州分行","屏東縣潮州鎮新生路９１號之１","08 7883101"
"0060383","花蓮分行","花蓮縣花蓮市中山路１２４號","03 8338111"
"0060394","台東分行","台東縣台東市中華路一段３３６號","089323011"
"0060408","澎湖分行","澎湖縣馬公市新明路２１號１樓","06 9272766"
"0060419","南京東路分行","台北市南京東路一段９８號","02 25623150"
"0060420","北高雄分行","高雄市中華三路２３２號","07 2863000"
"0060431","大同分行","台北市承德路三段１０號","02 25932323"
"0060442","和平分行","基隆市中正路３８９號","02 24622155"
"0060453","忠孝分行","台北市忠孝東路四段２８５號","02 27718811"
"0060464","景美分行","台北市文山區羅斯福路六段４５７號","02 29318111"
"0060475","士林分行","台北市士林區中正路４６９號１樓","02 28805161"
"0060486","汐止分行","台北縣汐止市忠孝東路２２５號","02 26413211"
"0060497","新莊分行","台北縣新莊市中正路２００號","02 29929981"
"0060501","中興分行","台中市公園路５號","04 22241161"
"0060512","苓雅分行","高雄市青年一路３９４號","07 2918151"
"0060545","台北分行","台北市復興北路５５號","02 27724277"
"0060567","營業部","台北市館前路７７號","02 23118811"
"0060578","南豐原分行","台中縣豐原市圓環南路１３８號","04 25244180"
"0060589","羅東分行","宜蘭縣羅東鎮公正路５１號","03 9545191"
"0060590","三民分行","高雄市博愛路一段３０號","07 3127190"
"0060604","城東分行","台北市松江路８７號","02 25070111"
"0060615","佳里分行","台南縣佳里鎮和平街８３號","06 7223131"
"0060626","中和分行","台北縣中和市泰和街９號","02 22499500"
"0060637","南高雄分行","高雄市三多三路９４號","07 3348141"
"0060648","南嘉義分行","嘉義市民族路７４６號","05 2286311"
"0060659","竹東分行","新竹縣竹東鎮長春路二段９２號","03 5963126"
"0060671","東三重分行","台北縣三重市三和路二段３７號","02 29728110"
"0060682","南興分行","台南市民生路二段７２號","06 2221291"
"0060693","五權分行","台中市公益路二段６１號","04 23229191"
"0060707","埔里分行","南投縣埔里鎮中山路二段２９９號","0492986411"
"0060718","大順分行","高雄市大順三路２０號","07 7131886"
"0060729","南勢角分行","台北縣中和市興南路一段２０號","02 29461266"
"0060730","朴子分行","嘉義縣朴子市海通路６２號","05 3794171"
"0060763","大安分行","台北市敦化南路二段８１巷１號","02 27553482"
"0060774","民權分行","台北市民權東路三段５８號","02 25057011"
"0060785","東高雄分行","高雄市中正三路２號","07 2366431"
"0060796","東台北分行","台北市忠孝東路四段３２５號","02 27721234"
"0060800","城內分行","台北市衡陽路８７號","02 23311041"
"0060811","建國分行","台北市信義路三段７７號","02 27027850"
"0060822","圓山分行","台北市中山北路二段８９之４號","02 25113245"
"0060833","信義分行","台北市信義路四段１７２號","02 27067188"
"0060844","長春分行","台北市長春路２０１號","02 25035015"
"0060855","仁愛分行","台北市仁愛路四段３２５號","02 27763071"
"0060866","玉成分行","台北市忠孝東路五段８１５號","02 27856060"
"0060877","古亭分行","台北市和平東路一段６５號","02 23949205"
"0060888","長安分行","台北市長安東路一段９號","02 25637181"
"0060899","松興分行","台北市南京東路五段２０２號之１","02 27643131"
"0060903","民族分行","台北市承德路三段２７７號","02 25962271"
"0060914","復興分行","台北市復興南路一段２３７號","02 27541111"
"0060925","雙連分行","台北市民生西路１１３號","02 25577151"
"0060936","民生分行","台北市民生東路三段１２６號","02 27181339"
"0060947","新生分行","台北市新生南路一段９３號","02 27771888"
"0060958","松江分行","台北市松江路１５２號","02 25224567"
"0060969","永吉分行","台北市松山路２７７號","02 27675226"
"0060981","東新莊分行","台北縣新莊市思源路３３９號","02 29973456"
"0060992","北三重分行","台北縣蘆洲市三民路８４號","02 82825678"
"0061003","前金分行","高雄市中華四路４５號","07 3363966"
"0061014","成大分行","台南市勝利路１３８號","06 3028001"
"0061025","大里分行","台中縣大里市中興路一段３８４號","04 24934111"
"0061036","海山分行","台北縣板橋市文化路二段４４３號","02 22551333"
"0061070","南台中分行","台中市忠明南路７８９號","04 22617211"
"0061081","埔墘分行","台北縣板橋市三民路二段３３號","02 29631122"
"0061092","慈文分行","桃園縣桃園市中正路７２０號","03 3578811"
"0061106","北寧分行","台北市南京東路四段１６號","02 25798811"
"0061117","迴龍分行","桃園縣龜山鄉萬壽路一段１６３號","02 82098266"
"0061128","太平分行","台中縣太平市中興路８４號","04 22761515"
"0061139","彰營分行","彰化縣彰化市民族路５３２號","04 7229221"
"0061140","彰儲分行","彰化縣彰化市中正路一段３２１號","04 7240082"
"0061151","虎尾分行","雲林縣虎尾鎮中正路１５號","05 6313821"
"0061162","南屯分行","台中市南屯區五權西路二段１０３號","04 24752171"
"0061173","西台中分行","台中市漢口路二段１５１號","04 23170311"
"0061184","溪湖分行","彰化縣溪湖鎮西環路５６號","04 8829121"
"0061195","烏日分行","台中縣烏日鄉中山路一段５９８號","04 23369911"
"0061209","和美分行","彰化縣和美鎮鹿和路六段３６１號","04 7570123"
"0061210","南桃園分行","桃園縣桃園市中山路８４５號","03 3692188"
"0061221","屏南分行","屏東縣屏東市民生路２５５號","08 7665511"
"0061232","東台南分行","台南市中華東路二段１９７號","06 2882211"
"0061243","北新竹分行","新竹市北大路１６８號","03 5284001"
"0061254","復旦分行","台北市市民大道四段１００號","02 27215551"
"0061265","竹山分行","南投縣竹山鎮集山路三段８３９號","0492652721"
"0061276","前鎮分行","高雄市前鎮區草衙一路５６號","07 8416491"
"0061287","灣內分行","高雄市三民區建工路８５４號","07 3861591"
"0061298","路竹分行","高雄縣路竹鄉國昌路６８號","07 6966122"
"0061302","憲德分行","高雄市公正路１８２號","07 7112046"
"0061313","竹北分行","新竹縣竹北市光明六路２６１號","03 5546000"
"0061324","六合分行","台北縣新店市三民路２號","02 29172911"
"0061335","五洲分行","台北市松江路２３７號","02 25077666"
"0061346","臺大分行","台北市中山南路７號地下一樓","02 23568071"
"0061368","龜山分行","桃園縣龜山鄉萬壽路二段１０６８號","03 3299661"
"0061379","大溪分行","桃園縣大溪鎮信義路４３號","03 3874666"
"0061380","龍潭分行","桃園縣龍潭鄉中正路２２１號","03 4893512"
"0061391","中原分行","桃園縣中壢市中北路二段３９２號","03 4688998"
"0061405","三興分行","台北市基隆路二段７７號","02 27388181"
"0061416","敦化分行","台北市敦化南路一段８８號","02 27769666"
"0061427","石牌分行","台北市石牌路二段２０１號","02 28747611"
"0061438","西屯分行","台中市文心路三段６７號","04 23112411"
"0061449","雙和分行","台北縣中和市建一路１９６號","02 82271627"
"0061450","土城分行","台北縣土城市中央路二段９６號","02 22651611"
"0061461","光華分行","高雄市光華一路１４８之８２號","07 2223020"
"0061472","北台南分行","台南市西門路三段１５９號","06 2209211"
"0061483","興鳳分行","高雄縣鳳山市中山路３２號","07 7453101"
"0061494","北屯分行","台中市文心路四段６７０號","04 22301199"
"0061508","一心路分行","高雄市前鎮區一心二路１１９號","07 3332020"
"0061519","三峽分行","台北縣三峽鎮文化路６１號","02 26747999"
"0061520","北嘉義分行","嘉義市德安路３號","05 2815500"
"0061531","永康分行","台南縣永康市中華路３５７號","06 2316971"
"0061542","平鎮分行","桃園縣平鎮市環河南路二段２９０號","03 4689299"
"0061553","大發分行","高雄縣大寮鄉會社村鳳林三路３４５號","07 7830589"
"0061564","內湖分行","台北市瑞光路５０２號","02 26590001"
"0061575","光復分行","新竹市東光路５７號","03 5753666"
"0061586","二重分行","台北縣三重市光復路一段８１號","02 29993399"
"0061601","北台中分行","台中市五權路３７５號","04 22055588"
"0061656","軍功分行","台中市東山路一段３１５號","04 22390128"
"0061715","永安分行","台中市西屯區永福路１５號","04 24623181"
"0061726","中權分行","台中市中正路４７８號","04 22037979"
"0061759","太原分行","台中市北屯路２４７號","04 22334291"
"0061760","松竹分行","台中市昌平路二段９５號","04 24228751"
"0061807","進化分行","台中市進化路３２８號","04 23609617"
"0061852","中清分行","台中市中清路７號","04 22913176"
"0061885","建成分行","台中市建成路１４９９號","04 22873311"
"0061900","朝馬分行","台中市西屯區中港路二段１２２之１７號","04 27013115"
"0061966","東台中分行","台中市復興路三段３８０號","04 22203161"
"0061988","美村分行","台中市美村路二段１８８號","04 22614377"
"0062000","黎明分行","台中市黎明路一段１０６４號","04 23892493"
"0062033","昌平分行","台中市昌平路一段１６３號","04 22443037"
"0062044","精武分行","台中市東區精武東路１７０號","04 22116358"
"0062055","文心分行","台中市文心路一段３１６號","04 23223300"
"0062077","神岡分行","台中縣神岡鄉中山路７０１之１號","04 25621111"
"0063029","彰中分行","彰化縣彰化市中正路一段３４５號","04 7251161"
"0063030","大竹分行","彰化縣彰化市大竹里彰南路二段２３９號","04 7373311"
"0063074","林內分行","雲林縣林內鄉林中村中西路２１號","05 5897811"
"0063100","南港分行","台北市南港區三重路１９之１３號","02 26550777"
"0063111","伸港分行","彰化縣伸港鄉新興路３５號","04 7996922"
"0063122","五股分行","台北縣五股鄉中興路一段２號","02 89769698"
"0063133","樹林分行","台北縣樹林市中山路一段１５２號","02 86872211"
"0063155","林口分行","桃園縣龜山鄉文化二路４９號","03 3183880"
"0063166","左營分行","高雄市左營區博愛路二段５８０號","07 5562226"
"0063177","泰山分行","台北縣泰山鄉明志路三段１４８號","02 29082811"
"0063188","南科高雄園區分行","高雄縣路竹鄉路科五路９２號","07 6955151"
"0063199","大坪林分行","台北縣新店市民權路６７號１樓","02 29138611"
"0063373","鶯歌分行","台北縣鶯歌鎮建國路１２６號１樓","02 86781188"
"0063384","蘆洲分行","台北縣蘆洲市集賢路２２２之６號","02 22839988"
"0063395","鹿港分行","彰化縣鹿港鎮民族路１２０號１樓","04 7788511"
"0063409","新樹分行","台北縣新莊市新樹路２２４號","02 22012797"
"0063410","六家分行","新竹縣竹北市光明六路東一段２５９號","03 6586969"
"0063421","大雅分行","台中縣大雅鄉雅環路二段９５號","04 25660199"
"0063432","大成分行","桃園縣楊梅鎮大成路２２１號","03 2888890"
"0063443","八德分行","桃園縣八德市介壽路一段７６７號","03 2185888"
"0063454","吉林分行","台北市民生東路二段１２５號","02 25633906"
"0063465","鼓山分行","高雄市鼓山區中華一路３５２號","07 5223311"
"0063476","大社分行","高雄縣大社鄉翠屏路１７７－１號","07 3582121"
"0063487","南京西路分行","台北市大同區南京西路４６號","02 25523000"
"0063498","逢甲分行","台中市西屯區西屯路２段２５２號１樓","04 27089075"
"0063502","立德分行","台北縣中和市立德街１０５號１樓","02 82282121"
"0063513","林園分行","高雄縣林園鄉林園北路２００號","07 6416171"
"0063524","高雄科技園區分行","高雄市前鎮區成功二路１１－２號１樓","07 5351888"
"0063535","蘆竹分行","桃園縣蘆竹鄉大竹路３８７號","03 3232010"
"0063546","北中和分行","台北縣中和市中山路三段３５號１樓","02 22263667"
"0063557","新湖分行","台北市內湖區新湖二路２５５號１樓","02 27908118"
"0063568","丹鳳分行","台北縣新莊市中正路６５７－１０號","02 29088979"
"0063580","旗山分行","高雄縣旗山鎮華中街３號","07 6622333"
"0065012","自強分行","台北市南京東路二段８５號","02 21003100"
"0065023","中山分行","台北市中山區南京東路二段２號","02 25214065"
"0065034","敦南分行","台北市大安區敦化南路一段３６２號","02 27011117"
"0065045","中崙分行","台北市信義區東興路４５號１樓","02 87681717"
"0065056","世貿分行","台北市基隆路一段３３３號２樓","02 27291333"
"0065067","延吉分行","台北市大安區仁愛路四段３７６之１號","02 27069955"
"0065078","光復南分行","台北市大安區光復南路１０２號","02 27518770"
"0065089","北士林分行","台北市士林區中山北路五段８３７號","02 88665959"
"0065090","信維分行","台北市大安區復興南路一段３０３號","02 27053828"
"0065104","西湖分行","台北市內湖區瑞光路２０６號","02 27971989"
"0065115","大湖分行","台北市內湖區民權東路六段３１４號","02 26328600"
"0065126","大橋分行","台北市大同區民權西路１３６號","02 25579577"
"0065137","國醫中心分行","台北市內湖區成功路二段３２５號","02 87925745"
"0065148","北圓山分行","台北市中山區中山北路三段３１號","02 25971630"
"0065159","南門分行","台北市羅斯福路一段９７號","02 23966363"
"0065160","新中分行","台中市民權路９１號","04 22237711"
"0065171","中港分行","台中市文心路三段１５２號","04 23138811"
"0065182","衛道分行","台中市北區大雅路３３７號１樓","04 22987988"
"0065193","忠明南路分行","台中市西區忠明南路４５１號","04 23764066"
"0065207","東基隆分行","基隆市信一路１４３號","02 24283111"
"0065218","赤崁分行","台南市成功路２０４號","06 2201302"
"0065229","府城分行","台南市健康路二段３８０號","06 2910896"
"0065230","開元分行","台南市開元路１４７號","06 2753345"
"0065241","港都分行","高雄市前金區中正四路２３０號","07 2914131"
"0065252","七賢分行","高雄市新興區七賢一路２１６號","07 2365503"
"0065263","大港埔分行","高雄市新興區民生一路１７６號","07 2265666"
"0065274","十全分行","高雄市三民區博愛一路１８９號","07 3230611"
"0065285","九如分行","高雄市三民區覺民路５８１號","07 3805001"
"0065296","小港分行","高雄市小港區宏平路５２６號","07 8062289"
"0065300","北三峽分行","台北縣三峽鎮文化路７１號","02 26711110"
"0065311","板新分行","台北縣板橋市文化路一段３０號","02 22726850"
"0065322","南三重分行","台北縣三重市正義北路１２０號","02 29817117"
"0065333","北新分行","台北縣新店市光明街２８８號","02 29188321"
"0065344","漳和分行","台北縣中和市連城路２４６之１號","02 22262829"
"0065355","寶橋分行","台北縣新店市寶橋路２３５巷２號","02 29185506"
"0065366","新泰分行","台北縣新莊市新泰路１１５號","02 29986688"
"0065377","北土城分行","台北縣土城市學府路一段２００號","02 22731688"
"0065388","南汐止分行","台北縣汐止市新台五路一段９４之１號","02 26968888"
"0065399","北樹林分行","台北縣樹林市中正路７９３號","02 26762789"
"0065403","五股工業區分行","台北縣五股鄉五工路１１９號","02 22989898"
"0065414","北羅東分行","宜蘭縣羅東鎮中正北路５４號","03 9545795"
"0065425","礁溪分行","宜蘭縣礁溪鄉礁溪路５段３２號１樓","03 9887100"
"0065436","東桃園分行","桃園縣桃園市中華路１２號","03 3355009"
"0065447","壢新分行","桃園縣中壢市中山路１１９號","03 4222131"
"0065458","南崁分行","桃園縣蘆竹鄉南上路１１號","03 3221199"
"0065469","大漢分行","桃園縣大溪鎮慈湖路９７號","03 3885696"
"0065470","新明分行","桃園縣中壢市中正路３６６號","03 4939393"
"0065481","楊梅分行","桃園縣楊梅鎮中山北路二段１９７號","03 4313838"
"0065492","東台東分行","台東縣台東市大同路１８１號","089325130"
"0065506","東竹東分行","新竹縣竹東鎮東林路９號","03 5942751"
"0065517","東竹北分行","新竹縣竹北市中正東路３４３號","03 5540108"
"0065528","北苗栗分行","苗栗縣苗栗市中正路３９６號","037351111"
"0065539","竹南分行","苗栗縣竹南鎮照南里２１鄰大營路２１８號","037466790"
"0065540","豐中分行","台中縣豐原市中正路３５１號","04 25280369"
"0065551","北大里分行","台中縣大里市新仁路二段２６１號","04 24836699"
"0065562","東沙鹿分行","台中縣沙鹿鎮日新街２６號","04 26653311"
"0065573","草屯分行","南投縣草屯鎮中正路８６４號","0492338141"
"0065584","集集分行","南投縣集集鎮民生路１７６號","0492761501"
"0065595","東埔里分行","南投縣埔里鎮中正路３２０號","0492989160"
"0065609","員新分行","彰化縣員林鎮中山路一段７３３號","04 8322741"
"0065610","南彰化分行","彰化縣彰化市曉陽路４３號","04 7254611"
"0065621","北斗分行","彰化縣北斗鎮中正路１６８號","04 8880181"
"0065632","竹塹分行","新竹市東門街６０號","03 5215120"
"0065643","新竹科學園區分行","新竹市科技路１號１樓","03 5783962"
"0065654","經國分行","新竹市自由路７１號","03 5311966"
"0065665","雲林分行","雲林縣斗六市民生路２２３號","05 5324811"
"0065676","南虎尾分行","雲林縣虎尾鎮信義路６７號１樓","05 6328851"
"0065687","北朴子分行","嘉義縣朴子市文化北路３號","05 3790808"
"0065698","北新營分行","台南縣新營市民治路３６０號","06 6562718"
"0065702","仁德分行","台南縣仁德鄉中正路三段４號","06 2794616"
"0065713","南永康分行","台南縣永康市中華路２０２號","06 3121916"
"0065724","新市分行","台南縣新市鄉中正路３２１之２號","06 5999111"
"0065735","鳳松分行","高雄縣鳳山市鳳松路３之４號","07 7471131"
"0065746","北岡山分行","高雄縣岡山鎮中山北路１２號","07 6222871"
"0065757","美濃分行","高雄縣美濃鎮中正路一段４３號","07 6816101"
"0065768","大樹分行","高雄縣大樹鄉中興東路２－８號","07 6517726"
"0065779","六龜分行","高雄縣六龜鄉義寶村光復路１０７號","07 6892113"
"0065780","內門分行","高雄縣內門鄉觀亭村南屏路１４８號","07 6672322"
"0065791","屏中分行","屏東縣屏東市民生路２８７號","08 7326391"
"0065805","北潮州分行","屏東縣潮州鎮新生路１１２號","08 7891636"
"0065816","東港分行","屏東縣東港鎮光復路一段１８６號","08 8353701"
"0065827","萬丹分行","屏東縣萬丹鄉萬惠村中興路二段６６１號","08 7779311"
"0065838","枋寮分行","屏東縣枋寮鄉天時村福德路３之１號","08 8717871"
"0065849","東嘉義分行","嘉義市民權路４２５號","05 2225281"
"0065850","北花蓮分行","花蓮縣花蓮市中山路３７１號","03 8350151"
"0065872","公館簡易型分行","台北市中正區羅斯福路四段１１３巷２９號","02 27352940"
"0065883","忠勤簡易型分行","台北市南港區忠孝東路六段３６０號","02 27857291"
"0065894","健康分行","台北市松山區健康路１３１號","02 27534765"
"0065908","博愛簡易型分行","台北市中正區博愛路１７２之１號","02 23822835"
"0065919","介壽簡易型分行","台北市中正區博愛路１６４號","02 23710461"
"0065920","文化簡易型分行","台北市中正區林森南路１０７號","02 23413261"
"0065931","復興崗分行","台北市北投區中央北路二路７０號","02 28941534"
"0065942","水湳分行","台中市西屯區福星北路６８巷１１１號","04 27029354"
"0065953","北安分行","台南市北區北安路一段２１０號","06 2526718"
"0065964","中正分行","高雄市苓雅區中正一路２號","07 7498998"
"0065986","光武簡易型分行","台北縣三峽鎮中正路三段１號","02 26712493"
"0065997","龍安分行","桃園縣桃園市龍安街１４０號","03 3789988"
"0066019","坪林分行","台中縣太平市中山路二段３４８號","04 23930519"
"0066053","溝坪簡易型分行","高雄縣內門鄉永村庄１１之１號","07 6601607"
"0066064","仁美分行","高雄縣鳥松鄉仁美村學堂路８７之２號","07 7321370"
"0066075","大華簡易型分行","高雄縣鳥松鄉大華村本館路１２之３號","07 3707332"
"0066097","社皮分行","屏東縣萬丹鄉社口村４３之１號","08 7071578"
"0066123","港湖分行","台北市南港區重陽路２２３號","02 27862268"
"0069021","五甲分行","高雄縣鳳山市五甲二路１６４號","07 7172250"
"0069043","淡水分行","台北縣淡水鎮中正路１１９號","02 26211415"